docId,title,content,source,url,publishedAt,year,collectedAt,accessibilityTarget,category,priority,isDisabilityRelated,sourceType,appRelevanceScore,appUseCase,targetKeywordGroup
,"충남남부장복 서포터즈 '이음', 발달장애인 선거지원 나서",[소셜포커스 현재웅 기자] = 충청남도남부장애인종합복지관(충남남부장복)은 지난 2일 복지관 대학생 서포터즈 '이음'이 발달장애인의 선거 참여 지원을 위한 AAC(보완대체의사소통) 안내자료를 제작했다고 밝혔다. 이번 활동은 의사소통에 어려움이 있는 발달장애인의 정보 접근성을 높이고 원활한 투표 참여를 지원하기 위해 마련됐다.이번에 제작된 AAC 안내자료는 총 10부다. 서포터즈 학생들은 발달장애인이 투표 절차와 유의사항을 보다 쉽게 이해할 수 있도록 자료를 직접 기획·제작했다. 특히 그림과 상징 중심으로 구성해 글을 읽거나 표현하는,소셜포커스 RSS,https://www.socialfocus.co.kr/news/articleView.html?idxno=23376,2026-06-05,2026,2026-06-18T23:40:19+09:00,ALL,보조기기,LOW,TRUE,RSS,92,BAND_NOTIFICATION,ASSISTIVE_DEVICE
,"경북지장협 김천시지회, 재가장애인 자조교실 운영",[소셜포커스 현재웅 기자] = 경상북도지체장애인협회(경북지장협) 김천시지회는 지난 4일 재가장애인 건강 증진을 위한 '재가장애인 자조교실' 프로그램 운영을 시작했다고 밝혔다. 이번 프로그램은 재가장애인의 건강관리 능력을 높이고 정서적 안정을 지원하기 위해 마련됐다.프로그램은 김천시보건소와 연계해 매주 목요일 8회 과정으로 진행된다. 교육 과정은 ▲건강관리 교육 ▲재활 활동 ▲공예수업 등 이다.이날 진행된 1회차 프로그램에는 재가장애인 10명이 참여했다. 참가자들은 ▲혈압 측정 ▲혈당 측정 ▲콜레스테롤 검사 등 기초 건강검진을 통해,소셜포커스 RSS,https://www.socialfocus.co.kr/news/articleView.html?idxno=23382,2026-06-05,2026,2026-06-18T23:40:19+09:00,PHYSICAL_IMPAIRED,의료/건강,MEDIUM,TRUE,RSS,81,INFO_CARD,
,"꽃 구경하다 보니 정상이었다, 거북이들의 곰배령 나들이",서울시립북부장애인종합복지관의 장애인 등산 프로그램 '거북이는 오른다'는 매년 상반기와 하반기에 각각 원정 산행을 진행한다. 서울을 벗어나 새로운 자연을 만나며 일상 속 둘레길 탐방을 넘어 더 큰 도전과 성취를 경험하는 자리다. 2026년 상반기 원정지로 선택된 곳은 강원특별자치도 인제군에 위치한 점봉산 곰배령이다.곰배령은 '천상의 화원'이라는 별칭으로 널리 알려진 국내 최대 규모의 야생화 군락지 중 하나다. 산림청이 관리하는 생태보호 구역에 속해 봄부터 가을까지 800여 종 이상의 식물이 서식하며 아름다운 자연경관과 풍부한 생태 자,소셜포커스 RSS,https://www.socialfocus.co.kr/news/articleView.html?idxno=23380,2026-06-05,2026,2026-06-18T23:40:19+09:00,ALL,일반뉴스,LOW,TRUE,RSS,43,NEWS_REFERENCE,
,"경기도 장애인콜택시, 횟수 제한과 미비한 규정이 가로막는 장애인 이동권",경기도 화성에서 장애인 인권운동단체를 운영하는 A씨는 휠체어에서 생활하는 중증장애인이다. 외출이나 직장 출퇴근 시에는 항상 장애인콜택시(이하 ‘장콜’)를 이용한다. 그런데 A씨가 지난 5월 27일경 퇴근을 위해 장콜을 이용하려다 황당한 일을 당했다. 경기도에서 장콜을 이용하는 사람은 현행 시스템에서는 누구나 당할 수 있는 사례다.장콜 제도는 「교통약자의 이동편의 증진법」(이하 ‘교통약자법‘)에 따라 휠체어를 이용하는 중증장애인 등 대중교통을 이용할 수 없는 사람에게 지자체가 막대한 예산을 들여 제공하는 특별교통수단이다. 그런데 경기,소셜포커스 RSS,https://www.socialfocus.co.kr/news/articleView.html?idxno=23363,2026-06-05,2026,2026-06-18T23:40:19+09:00,PHYSICAL_IMPAIRED,이동/교통,LOW,TRUE,RSS,89,POLICY_REFERENCE,
,"괴산군장애인복지관, 네패스아크와 친환경 위생용품 전달",[소셜포커스 현재웅 기자] = 괴산군장애인복지관(괴산장복)은 지난 5월 27일 반도체 테스트 전문기업 네패스아크 임직원들과 함께 지역 취약계층 장애인을 위한 친환경 위생용품 전달식을 진행했다고 밝혔다. 이번 전달식은 충북사회복지공동모금회와 연계한 지정기탁 방식의 후원사업으로 추진됐다.이날 네패스아크 임직원들은 복지관을 직접 방문해 ▲천연샴푸 ▲바디워시 ▲립밤 등으로 구성된 친환경 위생용품 200세트를 전달했다. 또 전달식 직후 현장에서 관내 장애인 200명에게 물품을 직접 배부하며 따뜻한 나눔을 실천했다.이를 통해 단순 후원을 넘어,소셜포커스 RSS,https://www.socialfocus.co.kr/news/articleView.html?idxno=23369,2026-06-04,2026,2026-06-18T23:40:19+09:00,ALL,일반뉴스,LOW,TRUE,RSS,43,NEWS_REFERENCE,
,"아산장복, 장애인활동지원사 직무보수교육 실시","[소셜포커스 현재웅 기자] = 아산시장애인복지관(아산장복)은 지난 2일 아산캠코인재개발원에서 활동지원사의 현장 대응 역량 강화를 위한 '2026년 제1차 장애인활동지원사 직무보수교육'을 실시했다고 밝혔다. 이번 교육은 연 4회 운영되는 법정의무교육의 일환으로, 활동지원사의 전문성 향상을 위해 마련됐다.이날 장애인활동지원사 180명이 참석했다. 교육 내용은 ▲장애유형과 장애 정도에 따른 활동지원급여 제공 방법 ▲제공 기준과 절차 이해 ▲부정수급 예방을 위한 청렴교육 ▲응급처치 요령 교육 등 실무 중심 내용으로 진행됐다.먼저 장애 특성",소셜포커스 RSS,https://www.socialfocus.co.kr/news/articleView.html?idxno=23368,2026-06-04,2026,2026-06-18T23:40:19+09:00,ALL,재난/안전,MEDIUM,TRUE,RSS,94,URGENT_ALERT,SAFETY_ACTION
